{
  "$schema": "https://farmslot.io/schemas/recipe-v1.schema.json",
  "title": "PR projections follow actual planning authority changes",
  "description": "Extend the existing five-collection account/authority proof with actual memory-only PR views. A private disposable owner is seeded through owning stores before its PR view opens; the existing watcher must admit the source. Keep the same browser document during downgrade and verify new source after recovery. No provider or upstream scan.",
  "proofTargets": [
    {
      "id": "principalSwitchClearsFive",
      "claim": "Switching accounts through the real UI deletes all five old saved planning collections."
    },
    {
      "id": "partialRoleRefetchesAllowed",
      "claim": "An operator downgrade retains farm access, freshly reads three allowed lists and clears saved roadmap/project facts."
    },
    {
      "id": "revokedRoleClearsFive",
      "claim": "Revoking the disposable account's admin role clears all five saved and cached planning collections."
    },
    {
      "id": "authorityRecoveryRefetchesFive",
      "claim": "Restored authority refetches all five lists through their actual mounted views."
    },
    {
      "id": "originalAccountRestored",
      "claim": "The original browser account is restored; test credentials and principal are retired without changing its roles."
    },
    {
      "id": "prAuthorityClearsProjection",
      "claim": "An admin-to-operator downgrade clears actual private PR facts and canonical observations while farm access remains."
    },
    {
      "id": "prAuthorityRecoveryReadsNewSource",
      "claim": "Restored authority renders a real private rule change made while access was absent through a fresh current read."
    }
  ],
  "workflow": {
    "entry": "prove",
    "nodes": {
      "prove": {
        "action": "command",
        "cmd": "node apps/command-center/scripts/prove-planning-authority.mjs pr-authority",
        "timeout_ms": 180000,
        "intent": "Switch account, revoke authority and recover actual planning and PR views.",
        "next": "switch"
      },
      "switch": {
        "action": "assert_output",
        "source": "prove",
        "stream": "stdout",
        "match": "\"principalSwitchClearsFive\":true",
        "intent": "Normal account switching deletes the previous principal's saved planning rows.",
        "proves": ["principalSwitchClearsFive"],
        "next": "partial-role"
      },
      "partial-role": {
        "action": "assert_output",
        "source": "prove",
        "stream": "stdout",
        "match": "\"partialRoleRefetchesAllowed\":true",
        "intent": "Keep farm access; clear forbidden facts and reread permitted lists.",
        "proves": ["partialRoleRefetchesAllowed"],
        "next": "revoke"
      },
      "revoke": {
        "action": "assert_output",
        "source": "prove",
        "stream": "stdout",
        "match": "\"revokedRoleClearsFive\":true",
        "intent": "A real admin-role revocation clears every saved planning collection.",
        "proves": ["revokedRoleClearsFive"],
        "next": "recover"
      },
      "recover": {
        "action": "assert_output",
        "source": "prove",
        "stream": "stdout",
        "match": "\"authorityRecoveryRefetchesFive\":true",
        "intent": "Restored authority requires new current reads on all five actual views.",
        "proves": ["authorityRecoveryRefetchesFive"],
        "next": "cleanup"
      },
      "cleanup": {
        "action": "assert_output",
        "source": "prove",
        "stream": "stdout",
        "match": "\"originalAccountRestored\":true",
        "intent": "Restore the original account and retire the disposable identity.",
        "proves": ["originalAccountRestored"],
        "next": "pr-cleared"
      },
      "done": {
        "action": "end",
        "status": "pass"
      },
      "pr-cleared": {
        "action": "assert_output",
        "source": "prove",
        "stream": "stdout",
        "match": "\"prAuthorityClearsProjection\":true",
        "intent": "Clear forbidden private PR projections on the actual role downgrade.",
        "proves": ["prAuthorityClearsProjection"],
        "next": "pr-recovered"
      },
      "pr-recovered": {
        "action": "assert_output",
        "source": "prove",
        "stream": "stdout",
        "match": "\"prAuthorityRecoveryReadsNewSource\":true",
        "intent": "Read the changed private PR source after authority returns.",
        "proves": ["prAuthorityRecoveryReadsNewSource"],
        "next": "done"
      }
    }
  }
}
