{
  "$schema": "https://farmslot.io/schemas/recipe-v1.schema.json",
  "title": "Opt-in assessment suggestions gateway preview",
  "description": "Proves the three explicit suggestions expose a bounded packet through the authenticated gateway without making any model calls. Run against a gateway serving the assessment suggestions methods.",
  "paramsSchema": {
    "type": "object",
    "additionalProperties": false,
    "properties": {
      "gateway_url": {
        "type": "string",
        "default": "ws://127.0.0.1:7777/ws"
      },
      "run_id": {
        "type": "string",
        "description": "An existing accessible run ID for the Co-Pilot preview."
      }
    },
    "required": ["run_id"]
  },
  "workflow": {
    "entry": "preview-review-routing",
    "nodes": {
      "preview-review-routing": {
        "action": "command",
        "cmd": "FARMSLOT_GATEWAY='{{params.gateway_url}}' node apps/command-center/scripts/cdp.mjs gateway assessment.suggestion.preview '{\"kind\":\"review-routing\",\"source\":{\"classification\":\"synthetic\",\"ref\":\"synthetic:assessment-suggestions\"},\"pr\":{\"host\":\"github.com\",\"repo\":\"example/app\",\"number\":42,\"headSha\":\"aaaaaaaaaaaaaaaaaaaaaaaaaaaaaaaaaaaaaaaa\"},\"context\":\"Synthetic change to navigation routing.\"}'",
        "next": "assert-review-routing-packet",
        "intent": "Preview the review-routing packet through the real gateway without calling a model."
      },
      "assert-review-routing-packet": {
        "action": "assert_output",
        "source": "preview-review-routing",
        "stream": "stdout",
        "contains": "\"kind\": \"review-routing\"",
        "next": "preview-static-review-checklist",
        "intent": "Require the gateway to return the bounded review-routing packet."
      },
      "preview-static-review-checklist": {
        "action": "command",
        "cmd": "FARMSLOT_GATEWAY='{{params.gateway_url}}' node apps/command-center/scripts/cdp.mjs gateway assessment.suggestion.preview '{\"kind\":\"static-review-checklist\",\"source\":{\"classification\":\"synthetic\",\"ref\":\"synthetic:assessment-suggestions\"},\"pr\":{\"host\":\"github.com\",\"repo\":\"example/app\",\"number\":42,\"headSha\":\"aaaaaaaaaaaaaaaaaaaaaaaaaaaaaaaaaaaaaaaa\"},\"context\":\"Synthetic change to navigation routing.\",\"items\":[{\"id\":\"navigation\",\"text\":\"Navigation reaches the intended route\",\"evidence\":\"src/nav.ts:12 redirects to /account\"}]}'",
        "next": "assert-static-review-checklist-packet",
        "intent": "Preview the static-review-checklist packet through the real gateway without calling a model."
      },
      "assert-static-review-checklist-packet": {
        "action": "assert_output",
        "source": "preview-static-review-checklist",
        "stream": "stdout",
        "contains": "\"kind\": \"static-review-checklist\"",
        "next": "preview-copilot-context",
        "intent": "Require the gateway to return the bounded static-review-checklist packet."
      },
      "preview-copilot-context": {
        "action": "command",
        "cmd": "FARMSLOT_GATEWAY='{{params.gateway_url}}' node apps/command-center/scripts/cdp.mjs gateway assessment.suggestion.preview '{\"kind\":\"copilot-context\",\"source\":{\"classification\":\"synthetic\",\"ref\":\"synthetic:assessment-suggestions\"},\"runId\":\"{{params.run_id}}\",\"context\":\"Read current run status before investigating an error.\",\"candidates\":[{\"id\":\"status\",\"description\":\"Read run status\"},{\"id\":\"logs\",\"description\":\"Read bounded run logs\"}]}'",
        "next": "assert-copilot-context-packet",
        "intent": "Preview the copilot-context packet through the real gateway without calling a model."
      },
      "assert-copilot-context-packet": {
        "action": "assert_output",
        "source": "preview-copilot-context",
        "stream": "stdout",
        "contains": "\"kind\": \"copilot-context\"",
        "next": "reject-stale-analysis",
        "intent": "Require the gateway to return the bounded copilot-context packet."
      },
      "done": {
        "action": "end",
        "status": "pass"
      },
      "reject-stale-analysis": {
        "action": "command",
        "cmd": "FARMSLOT_GATEWAY='{{params.gateway_url}}' node apps/command-center/scripts/cdp.mjs gateway assessment.suggestion.analyze '{\"input\":{\"kind\":\"review-routing\",\"source\":{\"classification\":\"synthetic\",\"ref\":\"synthetic:assessment-suggestions\"},\"pr\":{\"host\":\"github.com\",\"repo\":\"example/app\",\"number\":42,\"headSha\":\"aaaaaaaaaaaaaaaaaaaaaaaaaaaaaaaaaaaaaaaa\"},\"context\":\"Synthetic change to navigation routing.\"},\"expectedPacketHash\":\"0000000000000000000000000000000000000000000000000000000000000000\",\"confirmed\":true}'",
        "next": "assert-stale-no-call",
        "intent": "Send a confirmed but stale packet hash; the gateway must refuse it before reserving or calling a provider."
      },
      "assert-stale-no-call": {
        "action": "assert_output",
        "source": "reject-stale-analysis",
        "stream": "stdout",
        "contains": "\"reason\": \"stale\"",
        "next": "done",
        "intent": "The live gateway rejects a stale packet without a model call."
      }
    }
  }
}
